{
  "$schema": "https://json-schema.org/draft/2020-12/schema",
  "additionalProperties": false,
  "properties": {
    "expires_at": {
      "maximum": 1099511627776,
      "minimum": 0,
      "type": "integer"
    },
    "issued_at": {
      "maximum": 1099511627776,
      "minimum": 0,
      "type": "integer"
    },
    "kind": {
      "const": "revoke"
    },
    "nonce": {
      "minLength": 1,
      "type": "string"
    },
    "reason": {
      "minLength": 1,
      "type": "string"
    },
    "target": {
      "minLength": 1,
      "type": "string"
    },
    "target_kind": {
      "minLength": 1,
      "type": "string"
    },
    "tenant": {
      "minLength": 1,
      "type": "string"
    }
  },
  "required": [
    "expires_at",
    "issued_at",
    "kind",
    "nonce",
    "reason",
    "target",
    "target_kind",
    "tenant"
  ],
  "title": "WorldGate revocation payload",
  "type": "object"
}
